{
  "version": "openudon.browser-profile-transaction.v1",
  "id": "dedicated-registration",
  "kind": "registration",
  "state": "candidate",
  "candidates": [
    {
      "kind": "registration",
      "schema": "uws.browser-registration.1.0",
      "source_sha256": "sha256:1111111111111111111111111111111111111111111111111111111111111111",
      "review_sha256": "sha256:2222222222222222222222222222222222222222222222222222222222222222"
    }
  ],
  "provenance": {
    "producer": "browsertools",
    "result_version": "browsertools.registration-authoring.v1",
    "result_sha256": "sha256:3333333333333333333333333333333333333333333333333333333333333333",
    "observed_at": "2026-08-25T12:00:00Z",
    "expires_at": "2026-08-26T12:00:00Z",
    "origins": [
      "https://register.example.test"
    ]
  },
  "credential_bindings": [
    {
      "slot": "identifier",
      "binding": "registration_identifier"
    },
    {
      "slot": "password",
      "binding": "registration_password"
    }
  ]
}
